{"Instancia": "knapsack_hard_dataset_in_house_24_12_sightseeing_inverted", "Traje": "sightseeing", "Tipo_de_problema": "knapsack", "Subtipo_de_problema": "inverted", "Iteracion": 2, "Respuesta": "{\n  \"DECISION_VARIABLES\": [\n    {\n      \"SYMBOL\": \"I\",\n      \"DOMAIN\": \"INDEX_SET = {0..23}\",\n      \"MEANING\": \"Index set for the 24 attractions (0-indexed)\"\n    },\n    {\n      \"SYMBOL\": \"x\",\n      \"DOMAIN\": \"Binary for each i in I (x[i] in {0,1})\",\n      \"MEANING\": \"Decision variable: x[i]=1 if friend visits attraction i, 0 otherwise\"\n    }\n  ],\n  \"DATA_ROLES\": [\n    {\n      \"NAME\": \"SCORES\",\n      \"INDEXING\": \"LIST\",\n      \"MEANING\": \"Point value for each attraction in order index 0..23 (0-indexed)\"\n    },\n    {\n      \"NAME\": \"TIMES\",\n      \"INDEXING\": \"LIST\",\n      \"MEANING\": \"Minutes required for each attraction in order index 0..23 (0-indexed)\"\n    },\n    {\n      \"NAME\": \"THRESHOLD\",\n      \"INDEXING\": \"SCALAR\",\n      \"MEANING\": \"Minimum total minutes the friend should spend visiting attractions\"\n    }\n  ],\n  \"DATA\": {\n    \"SCORES\": [2, 23, 16, 18, 10, 17, 14, 2, 4, 4, 14, 23, 2, 8, 22, 23, 9, 10, 4, 5, 3, 12, 15, 10],\n    \"TIMES\": [210, 70, 120, 180, 170, 30, 20, 130, 190, 180, 190, 60, 180, 160, 80, 110, 80, 180, 220, 130, 70, 70, 50, 150],\n    \"THRESHOLD\": 2230\n  },\n  \"OBJECTIVE\": {\n    \"SENSE\": \"MIN\",\n    \"EXPRESSION_SOLVER_COMPATIBLE\": \"quicksum(SCORES[i]*x[i] for i in I)\"\n  },\n  \"CONSTRAINTS\": [\n    \"quicksum(TIMES[i]*x[i] for i in I) >= THRESHOLD\",\n    \"x[i] in {0,1} for all i in I\",\n    \"I = {0..23}\"\n  ],\n  \"SOLUTION_FORMAT\": {\n    \"TYPE\": \"LIST_OF_INTEGERS\",\n    \"DESCRIPTION\": \"0-indexed, comma-separated list of attraction indices to suggest to the friend (each integer in 0..23).\"\n  }\n}", "Feedback": "FEEDBACK: {\n  \"DECISION_VARIABLES\": [\n    {\n      \"SYMBOL\": \"I\",\n      \"DOMAIN\": \"INDEX_SET = {0..23}\",\n      \"MEANING\": \"Index set for the 24 attractions (0-indexed)\"\n    },\n    {\n      \"SYMBOL\": \"x\",\n      \"DOMAIN\": \"Binary for each i in I (x[i] in {0,1})\",\n      \"MEANING\": \"Decision variable: x[i]=1 if friend visits attraction i, 0 otherwise\"\n    }\n  ],\n  \"DATA_ROLES\": [\n    {\n      \"NAME\": \"SCORES\",\n      \"INDEXING\": \"LIST\",\n      \"MEANING\": \"Point value for each attraction in order index 0..23 (0-indexed)\"\n    },\n    {\n      \"NAME\": \"TIMES\",\n      \"INDEXING\": \"LIST\",\n      \"MEANING\": \"Minutes required for each attraction in order index 0..23 (0-indexed)\"\n    },\n    {\n      \"NAME\": \"THRESHOLD\",\n      \"INDEXING\": \"SCALAR\",\n      \"MEANING\": \"Minimum total minutes the friend should spend visiting attractions\"\n    }\n  ],\n  \"DATA\": {\n    \"SCORES\": [2, 23, 16, 18, 10, 17, 14, 2, 4, 4, 14, 23, 2, 8, 22, 23, 9, 10, 4, 5, 3, 12, 15, 10],\n    \"TIMES\": [210, 70, 120, 180, 170, 30, 20, 130, 190, 180, 190, 60, 180, 160, 80, 110, 80, 180, 220, 130, 70, 70, 50, 150],\n    \"THRESHOLD\": 2230\n  },\n  \"OBJECTIVE\": {\n    \"SENSE\": \"MIN\",\n    \"EXPRESSION_SOLVER_COMPATIBLE\": \"quicksum(SCORES[i]*x[i] for i in I)\"\n  },\n  \"CONSTRAINTS\": [\n    \"quicksum(TIMES[i]*x[i] for i in I) >= THRESHOLD\",\n    \"x[i] in {0,1} for all i in I\",\n    \"I = {0..23}\"\n  ],\n  \"SOLUTION_FORMAT\": {\n    \"TYPE\": \"LIST_OF_INTEGERS\",\n    \"DESCRIPTION\": \"0-indexed, comma-separated list of attraction indices to suggest to the friend (each integer in 0..23).\\n\\nDATA_ERROR: No data inconsistencies detected. SCORES and TIMES each contain 24 integer entries, all non-negative, and THRESHOLD is provided as a scalar (2230). Lengths and indexing are consistent with I = {0..23}.\\n\\nLOGIC_ERROR: No logical formulation errors found: objective minimizes the total score of selected attractions while the constraint enforces the minimum total visiting time. Implementation note: the provided expression uses solver-specific 'quicksum'; for generic verification with ast_eval / plain Python use 'sum' and explicit index iteration (see EVALUATION_FUNCTION below). Also explicitly ensure x is constrained to binary domain in your solver implementation (x[i] in {0,1} for i in range(24)).\\n\\nRESULTS_NOT_CONSISTENT: The KNOWN_RANDOM_SOLUTION [0,4,7,8,9,10,12,13,16,17,18,19,20,23] yields total score 87 and total time 2240, which satisfies the THRESHOLD >= 2230 and matches the EXPECTED_RESULT_FROM_SOLUTION (87). No inconsistency detected.\\n\\nEVALUATION_FUNCTION: Use this function (string) to verify any candidate solution with ast_eval or direct Python execution. It returns (total_score, total_time) for a 0/1 list x of length 24:\\n\\ndef evaluation_function(x):\\n    SCORES = [2,23,16,18,10,17,14,2,4,4,14,23,2,8,22,23,9,10,4,5,3,12,15,10]\\n    TIMES  = [210,70,120,180,170,30,20,130,190,180,190,60,180,160,80,110,80,180,220,130,70,70,50,150]\\n    total_score = sum(SCORES[i]*x[i] for i in range(24))\\n    total_time  = sum(TIMES[i]*x[i] for i in range(24))\\n    return total_score, total_time\\n\\nSUGGESTION_FOR_OPTIMALITY_CHECK: Use a local MILP solver (e.g., pulp, OR-Tools) to minimize the objective with the binary constraints to obtain ground-truth optimality. If using ast_eval for automatic checking, replace 'quicksum' with 'sum' and ensure x is a list of 0/1 integers before evaluation.\"\n  }\n}", "Datos": "24\n\n1 2 21\n2 23 7\n3 16 12\n4 18 18\n5 10 17\n6 17 3\n7 14 2\n8 2 13\n9 4 19\n10 4 18\n11 14 19\n12 23 6\n13 2 18\n14 8 16\n15 22 8\n16 23 11\n17 9 8\n18 10 18\n19 4 22\n20 5 13\n21 3 7\n22 12 7\n23 15 5\n24 10 15\n\n80\n", "Resultado_esperado": [0, 4, 7, 8, 9, 10, 12, 13, 16, 17, 18, 19, 20, 23], "Valor_Objetivo": 87, "tiempo": 350.681744291971}
{"Instancia": "knapsack_hard_dataset_in_house_24_15_sightseeing_inverted", "Traje": "sightseeing", "Tipo_de_problema": "knapsack", "Subtipo_de_problema": "inverted", "Iteracion": 2, "Respuesta": "{\n  \"DECISION_VARIABLES\": [\n    {\n      \"SYMBOL\": \"X\",\n      \"DOMAIN\": \"BINARY\",\n      \"MEANING\": \"X[i] = 1 if the friend visits attraction i, 0 otherwise; indexed by I\"\n    }\n  ],\n  \"DATA_ROLES\": [\n    {\n      \"NAME\": \"SCORE\",\n      \"INDEXING\": \"LIST\",\n      \"MEANING\": \"score (points) for each attraction, ordered by attraction index 0..23\"\n    },\n    {\n      \"NAME\": \"TIME\",\n      \"INDEXING\": \"LIST\",\n      \"MEANING\": \"time (minutes) required for each attraction, ordered by attraction index 0..23\"\n    },\n    {\n      \"NAME\": \"I\",\n      \"INDEXING\": \"LIST\",\n      \"MEANING\": \"index set for attractions (0-indexed)\"\n    }\n  ],\n  \"DATA\": {\n    \"SCORE\": [12, 2, 12, 13, 1, 16, 8, 10, 11, 23, 2, 13, 16, 14, 5, 19, 7, 9, 21, 21, 19, 4, 20, 14],\n    \"TIME\": [210, 150, 210, 170, 230, 30, 120, 60, 80, 30, 20, 190, 20, 50, 210, 160, 50, 220, 20, 160, 160, 160, 170, 190],\n    \"I\": [0, 1, 2, 3, 4, 5, 6, 7, 8, 9, 10, 11, 12, 13, 14, 15, 16, 17, 18, 19, 20, 21, 22, 23]\n  },\n  \"OBJECTIVE\": {\n    \"SENSE\": \"MINIMIZE\",\n    \"EXPRESSION\": \"quicksum(SCORE[i]*X[i] for i in I)\"\n  },\n  \"CONSTRAINTS\": [\n    \"quicksum(TIME[i]*X[i] for i in I) >= 3020\",\n    \"X[i] in {0,1} for i in I\"\n  ],\n  \"SOLUTION_FORMAT\": {\n    \"TYPE\": \"LIST\",\n    \"DESCRIPTION\": \"0-indexed comma-separated list of attraction indices selected (each an integer between 0 and 23). Optimal selection (minimizes total score while ensuring total time >=3020) is: 0,1,2,3,4,5,6,7,8,10,11,12,13,14,15,16,17,19,20,21,22,23 (i.e., all attractions except indices 9 and 18). This selection yields TOTAL_SCORE=248 and TOTAL_TIME=3020.\"\n  }\n}", "Feedback": "FEEDBACK: {\n  \"DECISION_VARIABLES\": [\n    {\n      \"SYMBOL\": \"X\",\n      \"DOMAIN\": \"BINARY\",\n      \"MEANING\": \"X[i] = 1 if the friend visits attraction i, 0 otherwise; indexed by I\"\n    }\n  ],\n  \"DATA_ROLES\": [\n    {\n      \"NAME\": \"SCORE\",\n      \"INDEXING\": \"LIST\",\n      \"MEANING\": \"score (points) for each attraction, ordered by attraction index 0..23\"\n    },\n    {\n      \"NAME\": \"TIME\",\n      \"INDEXING\": \"LIST\",\n      \"MEANING\": \"time (minutes) required for each attraction, ordered by attraction index 0..23\"\n    },\n    {\n      \"NAME\": \"I\",\n      \"INDEXING\": \"LIST\",\n      \"MEANING\": \"index set for attractions (0-indexed)\"\n    }\n  ],\n  \"DATA\": {\n    \"SCORE\": [12, 2, 12, 13, 1, 16, 8, 10, 11, 23, 2, 13, 16, 14, 5, 19, 7, 9, 21, 21, 19, 4, 20, 14],\n    \"TIME\": [210, 150, 210, 170, 230, 30, 120, 60, 80, 30, 20, 190, 20, 50, 210, 160, 50, 220, 20, 160, 160, 160, 170, 190],\n    \"I\": [0, 1, 2, 3, 4, 5, 6, 7, 8, 9, 10, 11, 12, 13, 14, 15, 16, 17, 18, 19, 20, 21, 22, 23]\n  },\n  \"OBJECTIVE\": {\n    \"SENSE\": \"MINIMIZE\",\n    \"EXPRESSION\": \"quicksum(SCORE[i]*X[i] for i in I)\"\n  },\n  \"CONSTRAINTS\": [\n    \"quicksum(TIME[i]*X[i] for i in I) >= 3020\",\n    \"X[i] in {0,1} for i in I\"\n  ],\n  \"SOLUTION_FORMAT\": {\n    \"TYPE\": \"LIST\",\n    \"DESCRIPTION\": \"0-indexed comma-separated list of attraction indices selected (each an integer between 0 and 23). FEEDBACK KEY-VALUE PAIRS: DATA_ERROR: KNOWN_RANDOM_SOLUTION as provided omits index 8. The listed solution [0,1,2,3,4,5,6,7,10,11,12,13,14,15,16,17,19,20,21,22,23] yields SCORE=237 and TIME=2940, which violates the time constraint (>=3020) and does not match EXPECTED_RESULT_FROM_SOLUTION (248). Suggested fix: include index 8 in the known solution so the selection becomes [0,1,2,3,4,5,6,7,8,10,11,12,13,14,15,16,17,19,20,21,22,23], producing SCORE=248 and TIME=3020. LOGIC_ERROR: The expressions use solver-specific quicksum which prevents direct local Python verification via ast_eval or plain eval. For local evaluation or ground-truth checks, replace quicksum with sum in OBJECTIVE and CONSTRAINTS (e.g., OBJECTIVE: \\\"sum(SCORE[i]*X[i] for i in I)\\\", CONSTRAINT: \\\"sum(TIME[i]*X[i] for i in I) >= 3020\\\"). Suggest this explicit change in OBJECTIVE.EXPRESSION and the first CONSTRAINT line. RESULTS_NOT_CONSISTENT: Independent verification computed SCORE=237 and TIME=2940 for the provided KNOWN_RANDOM_SOLUTION; these do not match EXPECTED_RESULT_FROM_SOLUTION (248) nor satisfy the TIME constraint. Evaluation function (Python) to verify any candidate solution: def evaluate(sol):\\n    s = sum(SCORE[i] for i in sol)\\n    t = sum(TIME[i] for i in sol)\\n    return {\\\"score\\\": s, \\\"time\\\": t}\\nUse evaluate(...) on the provided solution to reproduce the discrepancy. Actionable summary: 1) Correct the KNOWN_RANDOM_SOLUTION to include index 8 or update EXPECTED_RESULT_FROM_SOLUTION to 237 and TIME to 2940; 2) For local verification add a plain-sum evaluation (replace quicksum with sum); 3) Use the provided evaluate(...) snippet to automatically check candidate solutions and ensure consistency between reported totals and actual data.\"\n    }\n  }\n}", "Datos": "24\n\n1 12 21\n2 2 15\n3 12 21\n4 13 17\n5 1 23\n6 16 3\n7 8 12\n8 10 6\n9 11 8\n10 23 3\n11 2 2\n12 13 19\n13 16 2\n14 14 5\n15 5 21\n16 19 16\n17 7 5\n18 9 22\n19 21 2\n20 21 16\n21 19 16\n22 4 16\n23 20 17\n24 14 19\n\n5\n", "Resultado_esperado": [0, 1, 2, 3, 4, 5, 6, 7, 10, 11, 12, 13, 14, 15, 16, 17, 19, 20, 21, 22, 23], "Valor_Objetivo": 248, "tiempo": 909.1977949540014}
